{
  "version": 1,
  "level": 2,
  "label": "Foundation 002",
  "entries": [
    {
      "id": "L002-001",
      "en": "answer",
      "vi": "câu trả lời; trả lời",
      "ipa": "/ˈænsər/"
    },
    {
      "id": "L002-002",
      "en": "question",
      "vi": "câu hỏi",
      "ipa": "/ˈkwestʃən/"
    },
    {
      "id": "L002-003",
      "en": "problem",
      "vi": "vấn đề",
      "ipa": "/ˈprɑːbləm/"
    },
    {
      "id": "L002-004",
      "en": "idea",
      "vi": "ý tưởng",
      "ipa": "/aɪˈdiːə/"
    },
    {
      "id": "L002-005",
      "en": "change",
      "vi": "thay đổi",
      "ipa": "/tʃeɪndʒ/"
    },
    {
      "id": "L002-006",
      "en": "learn",
      "vi": "học",
      "ipa": "/lɜːrn/"
    },
    {
      "id": "L002-007",
      "en": "remember",
      "vi": "ghi nhớ",
      "ipa": "/rɪˈmembər/"
    },
    {
      "id": "L002-008",
      "en": "explain",
      "vi": "giải thích",
      "ipa": "/ɪkˈspleɪn/"
    },
    {
      "id": "L002-009",
      "en": "choose",
      "vi": "lựa chọn",
      "ipa": "/tʃuːz/"
    },
    {
      "id": "L002-010",
      "en": "improve",
      "vi": "cải thiện",
      "ipa": "/ɪmˈpruːv/"
    },
    {
      "id": "L002-011",
      "en": "simple",
      "vi": "đơn giản",
      "ipa": "/ˈsɪmpəl/"
    },
    {
      "id": "L002-012",
      "en": "important",
      "vi": "quan trọng",
      "ipa": "/ɪmˈpɔːrtənt/"
    },
    {
      "id": "L002-013",
      "en": "different",
      "vi": "khác biệt",
      "ipa": "/ˈdɪfrənt/"
    },
    {
      "id": "L002-014",
      "en": "possible",
      "vi": "có thể",
      "ipa": "/ˈpɑːsəbəl/"
    },
    {
      "id": "L002-015",
      "en": "enough",
      "vi": "đủ",
      "ipa": "/ɪˈnʌf/"
    },
    {
      "id": "L002-016",
      "en": "early",
      "vi": "sớm",
      "ipa": "/ˈɜːrli/"
    },
    {
      "id": "L002-017",
      "en": "together",
      "vi": "cùng nhau",
      "ipa": "/təˈɡeðər/"
    },
    {
      "id": "L002-018",
      "en": "message",
      "vi": "tin nhắn; thông điệp",
      "ipa": "/ˈmesɪdʒ/"
    },
    {
      "id": "L002-019",
      "en": "result",
      "vi": "kết quả",
      "ipa": "/rɪˈzʌlt/"
    },
    {
      "id": "L002-020",
      "en": "system",
      "vi": "hệ thống",
      "ipa": "/ˈsɪstəm/"
    },
    {
      "id": "L002-021",
      "en": "process",
      "vi": "quy trình; quá trình",
      "ipa": "/ˈprɑːses/"
    },
    {
      "id": "L002-022",
      "en": "create",
      "vi": "tạo ra",
      "ipa": "/kriˈeɪt/"
    },
    {
      "id": "L002-023",
      "en": "use",
      "vi": "sử dụng",
      "ipa": "/juːz/"
    },
    {
      "id": "L002-024",
      "en": "check",
      "vi": "kiểm tra",
      "ipa": "/tʃek/"
    },
    {
      "id": "L002-025",
      "en": "build",
      "vi": "xây dựng",
      "ipa": "/bɪld/"
    },
    {
      "id": "L002-026",
      "en": "decide",
      "vi": "quyết định",
      "ipa": "/dɪˈsaɪd/"
    },
    {
      "id": "L002-027",
      "en": "follow",
      "vi": "theo dõi; làm theo",
      "ipa": "/ˈfɑːloʊ/"
    },
    {
      "id": "L002-028",
      "en": "happen",
      "vi": "xảy ra",
      "ipa": "/ˈhæpən/"
    },
    {
      "id": "L002-029",
      "en": "reason",
      "vi": "lý do",
      "ipa": "/ˈriːzən/"
    },
    {
      "id": "L002-030",
      "en": "example",
      "vi": "ví dụ",
      "ipa": "/ɪɡˈzæmpəl/"
    }
  ]
}
